,kalimat_id,kata,sense,kalimat
195,210913,bidang,1802,penghargaan dianggap salah penghargaan arsitektur utama dunia penghargaan nobel bidang arsitektur
196,211005,bidang,1802,kompetensi mengajar kemampuan penguasaan materi bidang studi memadukannya metodologi pembelajaran teoretik praktik diimplementasikan proses pembelajaran
197,212580,bidang,1802,wawancara direkam kematiannya bourdieu bukunya bidang politik travail et travaileurs 1963 les heeritiers 1964
198,212807,bidang,1802,mayoritas penduduknya bergerak bidang pertanian
199,213145,bidang,1802,rombongan orang champa beragama budha dikenal piawai bidang kesenian membatik menari perhiasan emas peralatan kuningan
200,214370,bidang,1802,konsep kontrol bidang ilmu psikologi 1977 istilah efikasi
201,215347,bidang,1802,kepakarannya bidang geologi dihormati dunia internasional
202,215964,bidang,1802,kebutuhan sarjana bidang gizi kualitas prima kuantitas kecenderungan peningkatan peminat bidang studi gizi fkm ui meningkat 100 2007 dibanding
203,216082,bidang,1802,semenjak huruhara mei 1998 pasukan anti huruhara phh menerima latihan anti huruhara khususdan menerus pembaharuan bidang materi pelaksanaan pasukan huruharaphh
204,217146,bidang,1802,bidang geografi manusialingkungan ekologi budaya politik penelitian risikobencana
205,217264,bidang,1802,1993 menyelesaikan pendidikan spesialisasinya bidang administrasi manajemen universitas harvard
206,218,asing,5302,orang asing tertarik pusat perbelanjaan kehidupan malam
207,219154,bidang,1802,american idol musim kesembilan kelanjutan tayangan reality show bidang bernyanyi diselenggarakan fox kesembilan kalinya 12 januari 2010 26 mei 2010
208,220388,bidang,1802,padang ekspres berkembang cepat didukung tenagatenaga muda terampil bidang jurnalistik strata pendidikan terendah si
209,221852,bidang,1802,program studi utama dikembangkan sekolah bidang ilmu ekonomi jurusan manajemen akuntansi tahap beikutnya jurusan ilmu ekonomi studi pembangunan
210,222385,bidang,1802,pelit berbagi ilmunya guru pelatihan bidang komunikasi
211,222699,bidang,1802,bidang pelayaran radar mengatur jalur perjalanan kapal kapal berjalan lalang jalurnya masingmasing bertabrakan cuaca cuaca berkabut
212,223698,bintang,0701,m66 memanjang 95 ribu cahaya jalur debu mencolok gugus bintang terang lengan spiral
213,224411,bintang,0702,juara bintang radio televisi diraihnya festival 1983
214,226018,bintang,0703,daun muda ranting karangan bunga dihiasi rambut bintang rapat pendek berwarna perak mentega bertabur tepung
215,226317,bintang,0702,2011 majalah complex menempatkannya peringkat 94 daftar 100 bintang porno top terlaris
216,226834,bintang,0702,bintang bermain film warner baxter billie dove douglas fairbanks jr film mengambil latar death valley national park kota hantu rhyolite nevada
217,226922,bintang,0702,bintang bermain film mildred harris clara bow charles emmett mack tyrone power sr film dirilis tanggal 12 september 1923 dianggap film hilang
218,227850,bintang,0701,penelitian etnografi kepulauan caroline mikronesia mengungkap fakta metode navigasi bintang tradisional seharihari
219,22934,atas,4407,asisten centre national de la recherche scientifique as atas beasiswa rockefeller memungkinkannya mengunjungi perguruan uppsala oslo 19491950
220,229367,bintang,0701,claude ptolemy menempatkan bintang rasi andromeda almagest dipindahkan rasi perseus johann bayer ditetapkan upsilon persei
221,229829,bintang,0701,ditetapkan alpha magnitudo 432 bintang redup dibandingkan beta comae berenices
222,230194,bintang,0701,omicron geminorum gem geminorum salah bintang rasi gemini
223,230410,bintang,0701,gamma leonis leo leonis bintang ganda rasi leo
224,230596,bintang,0701,delta librae lib librae salah bintang rasi libra
225,231189,bintang,0703,lambang turki oval merah mengandung sabit bintang bendera turki dikelilingi nama resmi negara bahasa turki
226,232228,bintang,0701,origine de tous les cultes 1795 dupuis mengidentifikasi ritus prakristen siria raya mesir kuno persia perwakilan kelahiran dewa perawan titik musim dingin berargumen ritusritus berdasarkan kenaikan musim dingin rasi bintang virgo
227,236872,bisa,0101,penelitian 2003 melaporkan montmorilonit bisa mempercepat konversi asam lemak gelembung gelembung bisa membungkus rna melekat tanah liat
228,237114,bisa,0101,pramana menceraikan anita bisa merebut pratiwi arfian mila anita niat pramana
229,240206,bisa,0101,menemukan unsur nukleus bisa menangkap elektron orbit
230,242752,bisa,0101,maleficent berusaha mencabut kutukannya bisa katakatanya
231,243816,bisa,0101,berasal keluarga sederhana indah percaya bisa dibully
232,249400,bisa,0101,meningitis meningokokus pengobatan profilaksis orang berkontak erat antibiotik rifampisin siprofloksasin seftriakson bisa menurunkan risiko menderita penyakit melindungi infeksi
233,253834,bisa,0101,penghubungnya bernama rost van tonningen mussert bisa bertemu heinrich himmler adolf hitler
234,257830,bisa,0101,harvey bisa membujuk membawanya darat kekayaannya
235,258909,bisa,0101,allelujah bersalah membunuh kaumnya marie salahnya allelujah memaafkannya marie bersyukur bisa bertemu allelujah
236,267618,bisa,0101,minoritas tibetan yi qiang naxi bisa daerah barat membentuk transisi budaya asia asia timur
237,268112,bisa,0101,pantai lugina ditempuh jalan lintas selatan jawa barat bisa ditempuh 15 menit jarak tempuh 25 km
238,2682,asing,5302,christine siaran persnya turah produksi warna media dikirim mewakili indonesia kategori film berbahasa asing foreign language film
239,2699,asing,5302,pelaksanaan test bekerjasama lembaga bahasa asing universitas indonesia ui institut teknologi bandung itb universitas pendidikan indonesia upi
240,271079,bisa,0101,wilayah negara bisa mengklaim 200 mil laut penuh kehadiran negara tetangga menjadikan menetapkan batasan zee negaranegara tetangga pembatasan diatur hukum laut internasional
241,2727,asing,5302,perekonomian pagan memetik manfaat perniagaan orangorang asing bandarbandarnya daerah pesisir
242,276319,buah,0502,1847 menerbitkan novel satusatunya wuthering heights 2 3 buah set volume berjudul agnes grey saudara perempuannya anne
243,276394,buah,0502,buah kubah menghiasi bangunan masjid
244,278247,buah,0502,buah kapal dibangun hms invincible hms illustrious hms ark royal
245,278292,buah,0502,a mild live soundrenaline rock united album kompilasi dirilis 2006 berisi 10 buah lagu samsons kau kekasihku naff
246,279513,buah,0502,19 buah keuskupan 4 keuskupan agung 5 keuskupan sufragan
247,281696,buah,050x,samping buah catur standar variasi catur jenisjenis problem catur buah catur semu lazim
248,281720,buah,0501,penghasil buah duku kecapi
249,281964,buah,0501,padi tanaman pokok lestari dadi daerah penghasil buah semangka terbesar berkualitas kecamatan pegajahan
250,282561,buah,0502,lapangan ngapus pemboran 2 buah sumur masingmasing kedalaman 180 m 272 m menghasilkan
251,282786,buah,050x,sulaiman faisal riza santri muda ditugaskan kepala kampungnya mengusut kematiankematian wanita montok luka buah dadanya banyaknya mayat hilang
252,283233,buah,0501,durian buah musiman dulunya dipanen setahun
253,284966,buah,0502,perkembangan desa karatung mekarkan 3 buah desa
254,288595,bulan,0803,chelsea elizabeth manning tentara angkatan darat amerika serikat bulan juli 2013 dijatuhi hukuman pengadilan militer pelanggaran uu spionase pelanggaran membocorkan 750000 dokumen rahasia dokumen negara wikileaks
255,288778,bulan,0803,bulan januari 2014 album terjual 250000 kopi meraih multi platinum
256,289452,bulan,0803,atari 7800 konsol permainan video rilis atari bulan juni 1986
257,290897,bulan,0803,bulan juli diumumkan meninggalkan pertunjukan promosi negeri infinite
258,296464,bulan,0802,enam bulan penutupan pesta olahraga asia tenggara 2015
259,301,asing,5302,ekonomi pedesaan terpukul parah depresi 1930an kelebihan produksi komoditas agrikultural pertanian menyebabkan kejatuhan harga besarbesaran tiongkok peningkatan impor asing barangbarang pertanian diproduksi negaranegara barat dibuang tiongkok
260,301918,bulan,0803,bulan juni 2013 jetblue mengumumkan poin trueblue diperoleh kedaluwarsa alasan apapun
261,309999,bulan,0803,bulan juli 1950 au membuka pendaftaran pemuda indonesia dididik penerbangnavigator
262,313163,bulan,0803,bulan april 2007 film memegang rekor bertahan 600 minggu diputar terputus gedunggedung bioskop mumbai
263,316910,bulan,0803,direktur seni dance company of new south wales bulan november 1976 1979 perusahaan sydney dance company
264,323687,bulan,080x,curah hujan daerah kecamatan candung 3500 4000 mmtahun bulan kering
265,324232,bulan,0803,curah hujan 3000 mm musim kering bulan juni september musim hujan bulan november februari
266,325647,bunga,0601,wilayah sebarannya semak menghasilkan bunga berwarna kuning agustus oktober musim dingin pertengahan musim semi
267,325784,bunga,0601,motif bunga seruni air mengalir bawahnya kikusui
268,325970,bunga,0601,aroma bunga harum muncul teh hitam daun tembakau tua anggur buahbuahan disebabkan senyawa aromatik dihasilkan degradasi karotenoid
269,326172,bunga,0601,benang sari putik terpisah bunga berbeda tanaman berbeda tanaman penyerbukan alami
270,326328,bunga,060a,pernikahan melahirkan orang putri bernama we pancalktana bunga walie i pateka tana i hawang putra bernama la sangaji unru
271,326342,bunga,0601,kembang sore memiliki bunga mahkota bunga berwarna kuning jingga pucat
272,326587,bunga,060a,namanya dikenal industri pefilman menyutradari film habibie ainun dibintangi reza rahardian bunga citra lestari 2012
273,326763,bunga,0601,periode dinasti sui tercatat kaisar menikmati rangkaian bunga kertas sutera istananya musim dingin
274,327250,bunga,0602,konstruksi harga suku bunga mengalami kenaikan harga kontrak berjangka jatuh
275,327254,bunga,0601,dalamnya rupa avalokitesvara boddhisatva tingginya 5 meter berukuran raksasa mendiami rongga tengahnya menjulang dikelilingi gunungan buahbuahan bunga persembahan
276,327255,bunga,0601,matanya hidup lehernya putih susu bunga lili gading
277,327421,bunga,0601,pertempuran cures sakura shizuku bunga berinteraksi
278,327779,bunga,0602,simbolis kadangkadang pengiriman tanda penyerahan bunga mas penguasa semenanjung malaya dikirim raja siam upeti elang malta grand master ordo hospitaller dikirim viceroy sisilia menguasai malta
279,327783,bunga,0601,xenia dilaporkan teramati sawo manila kelapa biji kapas bunga matahari apel kurma pir
280,327889,bunga,0601,kumbang dewasa menyukai bunga turi larvanya memakan telurtelur belalang
281,327901,bunga,0602,eksponensiasi luas bidang ekonomi biologi kimia fisika ilmu komputer aplikasi bunga berbunga pertumbuhan penduduk kinetika kimia perilaku gelombang kriptografi kunci publik
282,328147,bunga,0601,bungabunga bunga hermafrodit pertumbuhannya
283,328184,bunga,0601,bunga pepaya memiliki mahkota bunga berwarna kuning pucat tangkai duduk batang
284,328914,bunga,0601,masuk eropa daun bunga mawar digantikan daun mint mudah
285,329517,bunga,0602,contohnya suku bunga venezuela 22 23 suriname
286,329708,cabang,5001,film hello goodbye bercerita indah atiqah hasiholan cabang kbri busan korea selatan bertemu pelaut indonesia bernama abi rio dewanto
287,330515,cabang,5001,cabang monkhmer bahasa bahasa khmer dipertuturkan 10 juta jiwa kamboja bahasa vietnam dipertuturkan 80 juta jiwa vietnam
288,330601,cabang,5001,salah cabang atletik dikenal maraton perlombaan lari kirakira 42 km
289,330824,cabang,5001,sumber situs resmi kantor cabang negara mengklaim jing wu didirikan seniman beladiri huo yuanjia meninggal berdirinya
290,330858,cabang,5001,pon xiv medali emas perak berhasil dimiliki sersan dewi saryaningsih sersan retno supriyantari terbaik masingmasing cabang terbang layang terjun payung peserta wanita
291,331114,cabang,5001,proses penggabungan pengorganisasian ulang cabang bank mandiri dikurangi 194 buah karyawannya berkurang 26600 17620
292,331213,cabang,5001,hr rasuna said jakarta selatan fhp edulaw memiliki cabang indonesia jakarta bandung surabaya medan jogjakarta
293,331334,cabang,5001,anggota partai buruh malta mlp aktif urusan partai anggota komite eksekutif mlp cabang perempuan partai mendirikan gerakan politik perempuan malta
294,331926,cabang,5001,crash cover salah cabang aerophilately dihargai jarang ditemukan bukti kecelakaan
295,332099,cabang,5001,terminologi ortodonsia diartikan cabang ilmu kedokteran gigi perawatan merapikan gigi bertujuan oklusi optimal fungsional mengutamakan nilai estetika gigi
296,332270,cabang,5001,filsafat hukum cabang filsafat membicarakan hakikat hukum tujuannya orang tunduk hukum
297,332531,cabang,5001,tanggal 1 september 2002 kantor cabang saksisaksi yehuwa australia hak istimewa mencetak publikasi negerinegeri samudera pasifik selandia kaledonia papua nugini vanuatu fiji negerinegeri kepulauan
298,332633,cabang,5001,keluarga natoli de nanteuil châtillon de villebeon du pont de nemours cabang keluarga
299,332939,cabang,5001,anton drexler tukang kunci penyair mendirikan cabang perkumpulan 7 maret 1918 munich
300,333119,cabang,5001,kritikkritik cenderung diarahkan cabang astrologi metodenya berusaha memprediksi nasib berdasarkan horoskop
301,333196,cabang,5001,mei 1940 upaya menentang pemerintah cabang partai komunis yugoslavia kpj montenegro menganjurkan tentara cadangan angkatan darat kerajaan yugoslavia demobilisasi menolak disiplin militer desersi
302,333197,cabang,5001,oktober konferensi nasional kpj keras mengkritik tindakan cabang partai montenegro mengarahkan kpj mempertahankan negara melawan penyerang imperialis
303,333294,cabang,5001,1968 mengklaim entomologi budaya cabang kajian serangga ulasan peran serangga cerita rakyat budaya agama makanan obatobatan seni
304,333479,cabang,5001,harvey wakil ketua cabang natal selatan pimpinannya peter smith harvey memublikasikan mengedit majalah south african patriot durban imprint patriotic press
305,334577,cabang,5001,pendidikan dasar mengenal huruf angka tanggung keluarga imam desa mata pelajaran sekunder trivium trimarga cabang ilmu tata bahasa retorika logika dipelajari sekolahsekolah katedral sekolahsekolah pemerintah kota
306,334730,cabang,5001,kamisna sekretaris djanilis saleh wakil sekretaris hasan basri d ba bendahara pengurus yappti cabang bakti lanjutan habis bhakti ditetapkan pengurus yappti pusat sk nomor 08kepyappti1986 tertanggal 11 maret 19863 pengurus yappti cabang balaiselasa sk yappti pusat darwis djafar ketua ketua iiiiiiiv malintang bumim
307,334751,cabang,5001,12555mp1963 tanggal 9 desember 1963 pengangkatan catur tunggal provinsi ntt presidium universitas ketua muhsalimsh kepala cabang kejaksaan kupang sekretaris drs
308,335545,cabang,5003,roto terletak persimpangan jalur ka broken hill jalur cabang temora griffith ditutup
309,335623,cabang,5001,iain sumatera utara mengasuh 5 fakultas fakultas tarbiyah fakultas syariah fakultas ushuluddin fakultas dakwah medan fakultas tarbiyah iain sumatera utara cabang padangsidimpuan
310,336091,cabang,5001,pangeran friso 1995 1996 konsultan manajemen internasional mckinsey cabang amsterdam
311,336273,cerah,4801,pasukanpasukan abad ke19 cenderung mengenakan warnawarna cerah berani rancanganrancangan mencolok
312,336278,cerah,4802,aransemennya cerah perkusi gaya pertunjukan agung
313,336293,cerah,4803,karier tinjunya bersinar cerah meraih medali perak kejuaraan tinju sejawa membawanya pelatnas nasional
314,336303,cerah,4801,bahasa jepang hujan lebat turun tibatiba langit cerah hujan panas kitsune no yomeiri pernikahan kitsune
315,336325,cerah,4801,memiliki bulu dominan coklat perbedaan minimal jenis kelamin spesies berwarna cerah
316,336433,cerah,4801,lansekap kota didominasi pegunugan pesisir utara pemandangan cerah mencapai gunung baker washington amerika serikat pulau vancouver seberang selat georgia pantai sunshine
317,336453,cerah,4803,orang india tinggal negeri dev menjanjikan geet cerah bahagia
318,336538,cerah,4801,cuaca cerah lazim memudahkan proses pemompaan air permukaan air turun jam tanggal 5 juli
319,336570,cerah,4801,partisipan ujicoba cahaya cerah kacamata hitam merasakan efek gelombang panas jarak 270 kilometer
320,336575,cerah,4801,desain tebal cerah kontemporer
321,336621,cerah,4801,bintang memiliki magnitudo 186 salah bintang cerah langit selatan
322,336668,cerah,4801,selesai wajah akrab muncul bingkai kamera menampilkan nama tentukan orang memprioritaskan fokus eksposur wajah terdaftar cerah fokus tajam
323,336673,cerah,4801,bentuk buahnya lonjongsilinder 37 cm berdiameter 23 cm muda warnanya merah cerah kuning terang tergantung jenisnya
324,336676,cerah,4801,tarian penari pakaian berwarna merah hijau warna cerah
325,336683,cerah,4801,kulitnya berwarna oranye cerah dihasilkan bakteri diolesi mentega paprika minyak
326,336721,cerah,4801,planet objek alami tercerah langit malam magnitudo 46 cerah menghasilkan bayangan
327,336752,cerah,4801,wirok bulubulu pendek kasar punggung dorsal berwarna gelap kelabu gelap coklat kehitaman perut ventral berwarna kelabu cerah kuning kecoklatan
328,336763,cerah,4801,badannya disepuh warna hijau cerah siripsiripnya berwarna coklat
329,336803,cerah,4801,inframerah spektrumnya badai neptunus cerah dibandingkan dingin ukuran bentuk fiturfitur planet dilacak
330,337076,coklat,4703,bulubulu didominasi warna coklat coklat zaitun punggung sayap ekor
331,337190,coklat,4703,buah masak berwarna coklat tua
332,337194,coklat,4703,warna utama rumah coklat dipakai warna kulit karakter
333,337294,coklat,4703,daerah magelang mengenalkan wajik ketan berwarna coklat gula merah oleholeh khas magelang blitar mengenalkan wajik kletik oleholeh khas blitar
334,337325,coklat,4703,warna kulit pauspilot sirippendek hitam coklat keabuabuan kecuali daerah dada punggung paus
335,337462,coklat,4703,kepala ringan area keputihputihan kaki ekor berbulu berwarna coklat kehitaman
336,337579,coklat,4703,berbutir merata coklat kehijauan kuning ubahan kfsp saladillo s chepes
337,337640,coklat,4703,perut berwarna putih gading lapisan coklat gelap dibawah
338,337903,coklat,4701,gambar termuat biarawati membawa baki berisi segelas coklat panas kotak merek
339,338037,coklat,4701,resep brownies tepung mentega gula telur coklat dilelehkan kacang almond
340,338197,coklat,4701,adonan dioles coklat digulung
341,338233,coklat,4703,iris coklat lingkar mata kuning paruh gelap kaki merahjambu
342,338268,coklat,4701,kue coklat biskuit resep keluarga kerajaan khusus pangeran william
343,338365,coklat,4703,hewan memiliki tubuh berwarna coklat kemerahan warna kulit kelabu bermata telinga menghadap memiliki bentuk lebar
344,3456,asing,5302,hidangan dianggap mengerikan orang asing memiliki kemiripan sosis darah bergaya barat puding hitam khas inggris irlandia bentuk kuah
345,36888,atas,4405,putra iililnir ii mendahuluinya atas takhta asyur
346,3890,asing,5302,mazhab melestarikan filsafatfilsafat etnis indonesia asli filsafatfilsafat dianut erat anggota etnis berhubungan tradisitradisi filosofis asing
347,4100,asing,5302,warga negara nonpersemakmuran republik irlandia anggota asing foreign member
348,412066,dalam,4010,desa sindagheula beriklim tropis musim dalam tahunnya musim kemarau penghujan suhu udara siang berkisar 24 31 derajat celcius
349,4125,asing,5302,swastanisasi perusahaanperusahaan pelayanan perusahaan minyak kantor pos telepon gas listrik perusahaan air arus dana investasi asing langsung besarbesaran menolong menjinakkan inflasi 5000 setahun 1980an praktis nol 1990an memperbaiki ekonomi dibayar tingkat pengangguran
350,427421,dalam,4008,dimana layak membangun sistem dalam keping aplikasi salah alternatifnya sistem dalam paket mencurigakan keping dalam paket
351,4366,asing,5302,disamping kanjeng sunan giri prihatin ancaman ulah pedagang asing eropa orang portugis menguasai nusantara pulau jawa
352,484316,dalam,4001,penempatan jendela skylight penggunaan fitur arsitektur merefleksikan cahaya dalam bangunan mengurangi kebutuhan pencahayaan buatan
353,5027,asing,5302,pabrikpabrik manufaktur asing didirikan kota pos perdagangan sapi hasil pertanian hutan apel kayu
354,5140,asing,5302,tamu hadir tamu lokal asing kgph
355,5353,asing,5302,diangkat notaris kebanyakan keturunan belanda timur asing
356,5356,asing,5302,bank indonesia mengatakanbahwa bank diambil asing dirawat 5
357,59454,atas,4406,sinode uskup menyelenggarakan sidangsidang menghimpun uskupuskup pemimpinpemimpin tarekat dipilih konferensikonferensi waligereja serikatserikat pemimpin tarekat sri paus suara atas proposalproposal propositiones diajukan dipertimbangkan sri paus praktiknya sri paus dasar pembuatan imbauan apostolik pascasinode sri paus tematema dibahas
358,598894,dalam,4010,penampilan penampilan dalam
359,67520,badan,1403,pemimpin distrik pemimpin lokal diajukan badan administrasi daerah
360,680,asing,5302,kerap dipertimbangkan calon mertua hebat menerima pinangan putriputrinya raja asing tushratta mitanni kadashmanenlil i babylon
361,68108,badan,1401,1115 deret vertikal bintikbintik putih masingmasing 25 bintik badan gurat sisi
362,68793,badan,140c,likuidasi sttal jajaran kobangdikal realisasi kebijakan panglima tni jenderal tni moeldoko memutuskan persetujuan validasi reposisi peningkatan organisasi sttal badan pelaksana pusat balakpus mabesal tujuan mengembangkan manajemen organisasi sttal arah penyesuaian jabatan peningkatan tugas pokok tataran kewenangan tanggung komandan sttal
363,70912,badan,1403,dewan menteri spanyol consejo de ministros kabinet kuba badan administratif eksekutif berpangkat tertinggi republik kuba mengurusi pemerintahan nasional
364,70966,badan,1403,sepakat pengamatan abdullah rimawi komando nasional badan pemerintahan partai baath menyimpang pemikiran baathis
365,71153,badan,1403,jalur rel dibangun land transport authority badan milik pemerintah singapura konsesi operasi perusahaan laba smrt corporation sbs transit
366,715180,dasar,4504,terletak pedalaman pelayanan dasar bidang pemerintahan kesehatan pendidikan diupayakan memelihara semangat maju berkembang keterbatasan
367,718724,dasar,4504,rowland institute for science didirikan edwin h land pendiri polaroid corporation organisasi penelitian dasar nonprofit 1980
368,724062,dasar,450d,pidato perbedaan undangundang dasar konfederasi amerika serikat
369,725259,dasar,4503,sekolah dasar negeri sdn pondok kelapa 12 petang sekolah dasar indonesia terletak komplek perumkar pemda dki pondok kelapa kecamatan duren sawit jakarta timur
370,72542,badan,1403,salah peninggalan yano menjabat kerukunan minangkabau gui gan badan diinisiasi mengkonsolidasi kekuatan elite minangkabau
371,727465,dasar,450x,pendidikan sekolah dasar diselesaikan his pindah sekolah anak orang eropa europesche lagere school els tamat 1924
372,72757,badan,140c,18 juli 2003 ditetapkan tersangka badan reserse kriminal polri pemalsuan ijazah digunakannya mencalonkan kepala daerah
373,727772,dasar,4502,delusi waham keyakinan dipegang kuat akurat bukti memiliki dasar realitas
374,72794,badan,140c,kedudukannya pembantu rektor rektor menteri agama ketua mui staf ahli mendikbud anggota badan pertimbangan pendidikan menulis karya ilmiah ceramah erat kaitannya kegiatan pendidikan
375,73018,badan,1403,surveyor kadastral keahlian bidang pengukuran pemetaan kadastral kemampuan mengorganisasi pekerjaan pengukuran pemetaan kadastral kewenangan pekerjaan pengukuran pemetaan kadastral rangka pendaftaran tanah usaha pelayanan masyarakat pegawai badan hukum berusaha bidang pengukuran pemetaan
376,73101,badan,1403,menjabat sekretaris dewan kesenian daerah kalsel 19711977 ketua badan koordinasi kesenian nasional indonesia kalsel 19781980 anggota pengurus dpd knpi kalsel 19791982 anggota majelis pertimbangan seniman dewan kesenian daerah kalsel 1994sekarang anggota lembaga budaya banjar kalsel 1944sekarang
377,731770,dunia,1304,tanggal 2 juli 2015 dedi supardi meninggal dunia rumah sakit sumber waras ciwaringin cirebon 1915 wib
378,734856,dunia,130d,februari 1940 alexander bletchley park pusat pemecah kode britania perang dunia ii
379,739695,dunia,130d,piala dunia fifa 2026 piala dunia fifa ke23 turnamen sepak bola internasional diadakan 2026
380,740413,dunia,1302,berita balikan tersebar luas dunia maya
381,74240,badan,1401,rakit membawa bima sungai ularular hidup sungai mematuk badan bima
382,74270,badan,140c,berdasarkan keputusan badan akreditasi nasional perguruan ban pt ditetapkan 16 januari 2014 unpad peringkat a
383,74633,badan,1403,verkhovna rada kali didirikan 1938 lembaga legislatif rss ukraina reorganisasi komite eksekutif pusat ukraina berubah verkhovna rada badan perwakilan republik dikenal uni soviet majelis agung
384,754600,dunia,1301,indonesia satusatunya negara dunia komponen tunggal dekstrometorfan ilegal resep dokter
385,754670,dunia,1302,berkarier dunia film 1985
386,757677,dunia,1304,eva cassidy meninggal dunia tanggal 2 november 1996 dikremasikan bowie maryland
387,75860,badan,1403,dianggap badan otonom akademi terkait dewan kepausan pelayanan pastoral badanbadan kuria roma
388,763774,dunia,1301,agama kristen denominasi britania raya agamaagama mayoritas dibawa imigran penjuru dunia
389,76757,badan,1403,tema film lengkunganpenjahat dr evil memeras uang pemerintah badan internasional digagalkan british super matamata austin powers gelar pengalaman kehidupan budaya 1990an
390,768767,dunia,1301,yayasan beroperasi wilayah dunia
391,769056,dunia,1303,berdasarkan data statista pengguna aktif amazon echo dunia 2015 angka 544 juta
392,769933,dunia,1301,daftar gununggunung berapi dunia
393,776874,dunia,1304,syekh abubakar bin salim meninggal dunia kota inat hadramaut yaman 27 dzulhijjah 992 hijriah
394,787964,dunia,1301,burung berkaki berleher tersebar dunia
395,792234,dunia,1304,peristiwa menandai tradisi penamaan zaman jepang sesuai pemerintahan kaisarnya menyebut nama kaisar meninggal dunia nama era pemerintahannya
396,795412,dunia,1302,tertarik dunia fotografi fashion gadget elektronik
397,795672,halaman,0402,5 februari band mengumumkan website halaman facebook pemain bass steven wussow pesan masuk studio album studio
