,kalimat_id,kata,sense,kalimat
608,968056,memecahkan,2503,final nba ray allen berhasil memecahkan rekor final nba delapan kali tembakan angka game 2
609,968123,memecahkan,2502,1991 assange berusia 20 teman berprofesi hacker pengacak komputer memecahkan memasuki jaringan terminal nortel perusahaan telekomunikasi kanada
610,968550,menangkap,3302,anak operasi polisi menangkap orang kulit hitam ilegal tinggal area
611,968555,menangkap,3302,air jernih ular garter sierra menangkap mangsanya efektif dibandingkan strategi ular garter menangkap mangsanya acak
612,968578,menangkap,3302,versi pesuruh kantor pemerintahan lokal bertugas menangkap penjahat melukai penduduk
613,968892,menangkap,3301,kepiting famili porcellanidae memiliki rambut mulut membantu menangkap partikel organik air mengalir melaluinya
614,968988,menangkap,3302,tom jarang sukses menangkap jerry disebabkan kepandaian kelincahan jerry kebodohan tom
615,969102,menangkap,3302,30 polisi mesir menangkap 50 orang mahasiswa anggota ikhwanul muslimin dilarang pemerintah berlibur alexandria pantai utara negara
616,969114,menangkap,3302,jj muncul episode lauren musim ketujuh dimana tolong membantu bau menemukan emily prentiss menangkap ian doyle
617,969437,menangkap,3302,kaisar memerintahkan eksarka ravenna menangkap paus
618,970195,menangkap,3302,630 kaisar taizong mengirim jendral li jing melawan tujue timur menangkap jiali khan menghancurkan pemerintahan tujue timur
619,970329,menangkap,3302,theodoros terbukti penguasa kuat suka perang memperluas negara epirus menangkap tesalonika 1224 dimahkotai kaisar
620,970655,menangkap,3302,berhasil mengalahkan pasukan kubarsi menangkap raja maliyatkustur
621,970694,menangkap,3302,efektif menangkap mengandangkan seekor pokémon pokémon suka poké ball
622,970917,menangkap,3302,mencapai lorong tanah sniper wolf menyergap melukai meryl menangkap snake
623,971058,menangkap,3301,menangkap seekor ikan hamil
624,971061,menangkap,3304,kamera keamanan menangkap gambar lincoln rumah sakit buron
625,971194,menangkap,3302,korawa berhasil menangkap samba samba dipenjarakan
626,971488,menangkap,3302,matthias menangkap jajce mengusir bangsa turki serbia utara melembagakan banats militer jajce srebernik wilayah bosnia dikuasai
627,971516,menangkap,3302,misteri terungkap penuturan harry a poeze sejarawan belanda menangkap menembak mati tan malaka tanggal 21 februari 1949 pasukan tni dibawah pimpinan letda soekotjo batalyon sikatan divisi brawijaya
628,971565,menangkap,3302,mogadorian menemukan john memanfaatkan teori konspirasi menangkap henri
629,971717,menangkap,3302,legiun berhasil menangkap pemberontak dipisahkan tentara utama pasukan spartakus gagal kelompok menyerang legiun mendekat
630,972013,mendorong,2602,perang enam mendorong israel tanggal 9 juni 1967 menguasai suez
631,972331,mendorong,2602,efek perang korea mendorong nato mengembangkan struktur militer
632,972838,mendorong,2602,memimpin sekolah pkt 1993 hu jintao perubahan mendorong diskusi terbuka membahas reformasi
633,973255,mendorong,2601,kabel alat memicu alat peledak mendorong pisau memotong kabel
634,973510,mendorong,2601,gelombang timbul temporer angin menekan air darat mendorong air menggantikannya
635,973900,mendorong,2602,tujuan prosedur membiasakan peserta substansial topik perdebatan mendorong penelitian akademik menulis mengaktifkan persiapan konferensi
636,973962,mendorong,2602,maret 2016 pemilihan pendahuluan super tuesday menghentikan kampanyenya mengumumkan ketua my faith votes kelompok mendorong orang kristen menjalankan tugas sipil memilih
637,974719,mendorong,2602,historis orang tionghoa kontribusi perekonomian kota migrasi periode kesultanan brunei ditemukan bijih antimon pemerintahan charles vyner brooke mendorong migrasi orang tionghoa negara menanam lada hitam serawak
638,974811,mendorong,2602,rafi lelaki nakal suka bergantiganti pacar mendorong bagas cintanya alex panggilan alexandria
639,975672,mendorong,2602,okar evolusi menolak keberadaan tuhan menghilangkan nilai moral mendorong materialisme komunisme
640,975957,mendorong,2602,moody brookes kaum dispensasionalis mendorong penyebaran dispensasionalisme mempelajari nuansanuansa sistem dispensasionalis
641,978415,menerima,3101,9 sekretaris studio menerima panggilan telepon
642,98136,baru,390d,prestasi menjadikan winds penerima penghargaan rekaman jepang artis pendatang baru terbaik 2002
643,981819,menerima,3102,gugurnya duryodana mahabharata kresna menerima kutukan duryodana gandari
644,98383,baru,3901,hidangan istimewa pesta malam baru sampanye foie gras
645,989281,menerima,3102,suruci melarangnya utama dinobatkan raja druwa disayangi menerima kasih sayang diterima utama
646,994570,mengandung,2301,mengandung paba aminobenzoic acid asam ferulat allantoin beras sebegai pemutih pencerah kulit
647,994574,mengandung,2301,kopi robusta kopi kelas 2 pahit asam mengandung kafeina kadar
648,995972,mengandung,2301,perak mudah menyerap neutron bebas batang pengendali mengatur reaksi fisi nuklir reaktor nuklir air bertekanan bentuk alloy mengandung 80 perak 15 indium 5 kadmium
649,996060,mengandung,2301,senyawa industri amonia asam nitrat nitrat organik propelan bahan peledak sianida mengandung nitrogen
650,996671,mengandung,2301,tanaman memiliki buah berbentuk kapsul mengandung 23 biji berkerut bentuk biji tanaman adam eva
651,997586,mengandung,2301,model dasar telur goreng irisan roti roti lapis mengandung variasi mencakup telur goreng bacon sosis keju potongan dingin topping hamburger
652,998147,mengandung,2301,2000an indonesia diperkenalkan pupuk majemuk mengandung ketiga unsur pokok
653,999241,mengandung,2301,magma teluk mengandung gas terlarut tekanan magma
654,999441,mengandung,2301,naratif narrative mengandung unsur judul title orientasi orientation komplikasicomplication resolusi resolution
655,999728,mengandung,2301,peribahasa pepatah ayat kelompok susunan mengandung aturan dasar berperilaku
